{
  "schema_version": "1.0",
  "source_id": "synthetic-mt5-agent",
  "account_scope": "synthetic-demo",
  "assessment_status": "INCONCLUSIVE",
  "evidence_method": "synthetic_insufficient_samples",
  "assessed_at_utc": "2026-01-01T00:00:00Z",
  "covered_start_utc": "2025-01-01T00:00:00Z",
  "covered_end_utc": "2025-02-01T00:00:00Z",
  "observations": [],
  "dst_behaviour": "synthetic_unknown",
  "limitations": [
    "synthetic_test_only"
  ],
  "evidence_fingerprint": "41b6d82efa19fa2c795c476bebc97233d10d11495e119cabd3c9adbf8a7537bf"
}
